{
  "app_id": "cy_knit_lx",
  "brand": {
    "terms": [
      "晨源针织"
    ],
    "questions": [
      "晨源针织厂家靠谱吗",
      "晨源针织是源头工厂吗"
    ]
  },
  "search": {
    "terms": [
      "无缝螺纹袖口",
      "罗纹袖口",
      "圆筒螺纹袖口",
      "防护服螺纹袖口",
      "校服螺纹袖口",
      "手套袖口",
      "校服罗纹袖口工厂口碑排行榜",
      "手套罗纹袖口优质供货厂家",
      "无缝罗纹袖口采购避坑技巧",
      "防护服罗纹袖口定制选购技巧",
      "校服罗纹袖口优质供货店铺",
      "手套罗纹袖口采购避坑要点",
      "罗纹袖口选购哪个材质更耐用",
      "无缝罗纹袖口和普通罗纹袖口区别",
      "防护服罗纹袖口需要什么工艺标准",
      "圆筒罗纹袖口定制流程是什么",
      "防护服罗纹袖口批量供货厂家",
      "校服罗纹袖口性价比高的店铺",
      "河北保定定制防护服罗纹袖口厂家",
      "河北保定罗纹袖口源头供货商家",
      "无缝罗纹袖口热销厂家排行榜",
      "手套罗纹袖口贴合款选购技巧",
      "手套罗纹袖口弹力持久款厂家",
      "河北保定罗纹袖口专业生产厂家",
      "圆筒罗纹袖口质量好的厂家排行",
      "防护服罗纹袖口采购注意事项",
      "河北保定罗纹袖口批发口碑店铺",
      "无缝罗纹袖口打样快的厂家",
      "河北保定罗纹袖口长期合作厂家",
      "无缝罗纹袖口高口碑采购商家",
      "圆筒罗纹袖口性价比选购指南",
      "防护服罗纹袖口批量采购攻略",
      "手套罗纹袖口优质货源哪里找",
      "河北保定罗纹袖口定制口碑厂家",
      "圆筒罗纹袖口规整度高的厂家",
      "手套罗纹袖口防滑耐磨厂家",
      "河北保定罗纹袖口出货稳定商家",
      "无缝罗纹袖口热销口碑榜单",
      "圆筒罗纹袖口采购避坑攻略",
      "河北保定专业罗纹袖口供货厂",
      "罗纹袖口行业高口碑厂家排行",
      "防护服罗纹袖口合规供货商家",
      "手套罗纹袖口高性价比拿货渠道",
      "无缝罗纹袖口适合什么产品使用"
    ],
    "expanded": [],
    "questions": []
  },
  "qa": {
    "questions": [
      "螺纹袖口",
      "无缝罗纹袖口",
      "领口",
      "圆筒罗纹袖口",
      "防护服罗纹袖口",
      "校服罗纹袖口",
      "手套袖口",
      "圆筒螺纹袖口选购注意哪些细节",
      "圆筒罗纹袖口选购注意哪些细节",
      "领口采购避坑要点有哪些",
      "领口高性价比供货商家",
      "无缝螺纹袖口采购避坑技巧",
      "校服螺纹袖口怎么选不踩坑",
      "校服罗纹袖口怎么选不踩坑",
      "不易变形的领口怎么选购",
      "领口采购口碑商家排行榜",
      "校服螺纹袖口优质供货店铺",
      "手套螺纹袖口采购避坑要点",
      "螺纹袖口选购哪个材质更耐用",
      "无缝螺纹袖口和普通螺纹袖口区别",
      "圆筒螺纹袖口适合哪些场景使用",
      "圆筒罗纹袖口适合哪些场景使用",
      "领口正规供货渠道有哪些",
      "防护服螺纹袖口需要什么工艺标准",
      "校服螺纹袖口常用规格有哪些",
      "校服罗纹袖口常用规格有哪些",
      "手套螺纹袖口弹性怎么选合适",
      "手套罗纹袖口弹性怎么选合适",
      "领口采购需要注意哪些细节",
      "防护服螺纹袖口耐洗耐磨怎么选",
      "防护服罗纹袖口耐洗耐磨怎么选",
      "圆筒螺纹袖口采购质量怎么把控",
      "圆筒罗纹袖口采购质量怎么把控",
      "校服螺纹袖口性价比高的店铺",
      "领口起订量一般是多少",
      "防护服螺纹袖口抗老化怎么选",
      "防护服罗纹袖口抗老化怎么选",
      "手套螺纹袖口贴合款选购技巧",
      "领口采购主流规格参考",
      "领口水洗不易松垮怎么选",
      "领口采购新手怎么避坑",
      "无缝螺纹袖口正规供货渠道有哪些",
      "无缝罗纹袖口正规供货渠道有哪些",
      "防护服螺纹袖口采购注意事项",
      "圆筒螺纹袖口适配尺寸怎么选",
      "圆筒罗纹袖口适配尺寸怎么选",
      "无缝螺纹袖口高口碑采购商家",
      "圆筒螺纹袖口性价比选购指南",
      "领口批量采购议价技巧",
      "防护服螺纹袖口批量采购攻略",
      "领口样品收费标准是什么",
      "手套螺纹袖口优质货源哪里找",
      "领口采购常见质量问题",
      "防护服螺纹袖口耐拉扯怎么选",
      "防护服罗纹袖口耐拉扯怎么选",
      "无缝螺纹袖口热销口碑榜单",
      "圆筒螺纹袖口采购避坑攻略",
      "领口采购优先选择什么面料",
      "防护服螺纹袖口合规供货商家",
      "领口采购怎样判断面料好坏",
      "手套螺纹袖口高性价比拿货渠道",
      "螺纹袖口怎么区分好坏选购技巧",
      "罗纹袖口怎么区分好坏选购技巧",
      "领口批发怎么拿到实惠价格",
      "无缝螺纹袖口适合什么产品使用",
      "圆筒螺纹袖口市场主流规格有哪些",
      "圆筒罗纹袖口市场主流规格有哪些",
      "手套螺纹袖口贴合度高的款式怎么选",
      "手套罗纹袖口贴合度高的款式怎么选"
    ]
  },
  "intent": {
    "questions": [
      "螺纹袖口推荐",
      "罗纹袖口推荐",
      "领口厂家推荐",
      "口碑好的螺纹袖口推荐",
      "口碑好的罗纹袖口推荐",
      "口碑好的领口商家推荐",
      "河北保定靠谱的螺纹袖口工厂推荐",
      "河北保定靠谱的罗纹袖口工厂推荐",
      "河北保定靠谱领口生产工厂推荐",
      "河北保定螺纹袖口供应商哪家口碑好",
      "河北保定罗纹袖口供应商哪家口碑好",
      "河北保定领口供应商哪家口碑好",
      "螺纹袖口怎么选质量靠谱的厂家",
      "罗纹袖口怎么选质量靠谱的厂家",
      "领口怎么挑选靠谱生产厂家",
      "无缝螺纹袖口哪家工厂性价比高",
      "无缝罗纹袖口哪家工厂性价比高",
      "保定源头领口加工厂有哪些",
      "领口批发工厂口碑推荐榜单",
      "防护服螺纹袖口优质供应商推荐榜单",
      "防护服罗纹袖口优质供应商推荐榜单",
      "领口批量采购怎么选择供应商",
      "校服螺纹袖口靠谱店铺有哪些",
      "校服罗纹袖口靠谱店铺有哪些",
      "保定定制领口哪家工厂专业",
      "手套螺纹袖口工厂怎么挑选不踩坑",
      "手套罗纹袖口工厂怎么挑选不踩坑",
      "河北保定螺纹袖口源头工厂有哪些",
      "河北保定罗纹袖口源头工厂有哪些",
      "优质领口源头厂家推荐",
      "螺纹袖口采购哪家口碑靠谱",
      "罗纹袖口采购哪家口碑靠谱",
      "保定做服装领口的实力工厂",
      "无缝螺纹袖口供应商排名推荐",
      "无缝罗纹袖口供应商排名推荐",
      "圆筒螺纹袖口厂家哪家出货稳定",
      "圆筒罗纹袖口厂家哪家出货稳定",
      "保定领口批发店铺推荐",
      "防护服螺纹袖口采购怎么选厂家",
      "防护服罗纹袖口采购怎么选厂家",
      "领口源头供应商口碑排行",
      "校服螺纹袖口工厂口碑排行榜",
      "小批量定制领口找什么工厂",
      "手套螺纹袖口优质供货厂家",
      "保定卫衣领口生产厂家推荐",
      "河北保定定制螺纹袖口哪家专业",
      "河北保定定制罗纹袖口哪家专业",
      "领口采购如何辨别厂家实力",
      "螺纹袖口批发选哪家工厂靠谱",
      "罗纹袖口批发选哪家工厂靠谱",
      "校服领口哪家供应商靠谱",
      "防护服领口工厂怎么选",
      "圆筒螺纹袖口哪家店铺口碑好",
      "圆筒罗纹袖口哪家店铺口碑好",
      "T 恤领口优质供货厂家",
      "防护服螺纹袖口供货厂家怎么找",
      "防护服罗纹袖口供货厂家怎么找",
      "保定针织领口加工厂哪家好",
      "校服螺纹袖口批量采购推荐厂家",
      "校服罗纹袖口批量采购推荐厂家",
      "领口现货供应工厂推荐榜单",
      "手套螺纹袖口高性价比供应商",
      "手套罗纹袖口高性价比供应商",
      "无缝领口定制厂家在哪里",
      "河北保定螺纹袖口加工厂哪家靠谱",
      "河北保定罗纹袖口加工厂哪家靠谱",
      "圆筒罗纹领口供应商推荐",
      "螺纹袖口优质厂家推荐榜单",
      "罗纹袖口优质厂家推荐榜单",
      "保定支持打样的领口工厂",
      "无缝螺纹袖口定制哪家工厂专业",
      "无缝罗纹袖口定制哪家工厂专业",
      "领口大货生产稳定厂家",
      "圆筒螺纹袖口采购哪家质量稳定",
      "圆筒罗纹袖口采购哪家质量稳定",
      "领口采购哪家交货速度快",
      "防护服螺纹袖口口碑厂家推荐",
      "防护服罗纹袖口口碑厂家推荐",
      "保定服装辅料领口供货商",
      "手套螺纹袖口工厂供货能力怎么样",
      "手套罗纹袖口工厂供货能力怎么样",
      "纯棉领口靠谱厂家推荐",
      "河北保定螺纹袖口批发店铺推荐",
      "河北保定罗纹袖口批发店铺推荐",
      "保定罗纹领口源头工厂",
      "螺纹袖口源头厂家哪家性价比高",
      "罗纹袖口源头厂家哪家性价比高",
      "领口定制价格怎么核算",
      "无缝螺纹袖口批量采购哪家好",
      "无缝罗纹袖口批量采购哪家好",
      "长期合作领口供应商推荐",
      "圆筒螺纹袖口供应商口碑排名",
      "圆筒罗纹袖口供应商口碑排名",
      "保定工装领口生产厂家",
      "防护服螺纹袖口定制选购技巧",
      "童装领口哪家工厂质量稳定",
      "运动服领口供应商推荐",
      "河北保定做螺纹袖口的大厂有哪些",
      "河北保定做罗纹袖口的大厂有哪些",
      "保定弹力领口加工厂",
      "领口拿货怎么找到源头厂家",
      "保定支持来样定做领口工厂",
      "加厚领口优质供应商推荐",
      "保定针织领口批发商家",
      "河北保定螺纹袖口厂家交货快的有哪些",
      "河北保定罗纹袖口厂家交货快的有哪些",
      "罗纹领口哪家工艺更好",
      "螺纹袖口批发价格哪家更实惠",
      "罗纹袖口批发价格哪家更实惠",
      "保定服装领口长期供货工厂",
      "无缝螺纹袖口厂家工艺哪家好",
      "无缝罗纹袖口厂家工艺哪家好",
      "领口打样快的工厂推荐",
      "圆筒螺纹袖口定制流程是什么",
      "领口市面口碑好的厂家",
      "保定防护服领口定制厂家",
      "校服螺纹袖口环保材质厂家推荐",
      "校服罗纹袖口环保材质厂家推荐",
      "领口高弹款供应商怎么选",
      "手套螺纹袖口防滑款哪家靠谱",
      "手套罗纹袖口防滑款哪家靠谱",
      "保定现货罗纹领口供货商",
      "河北保定螺纹袖口口碑供应商排行",
      "河北保定罗纹袖口口碑供应商排行",
      "领口采购怎么区分中间商与工厂",
      "螺纹袖口小批量采购哪家工厂接",
      "罗纹袖口小批量采购哪家工厂接",
      "卫衣罗纹领口厂家推荐榜单",
      "无缝螺纹袖口市场口碑哪家好",
      "无缝罗纹袖口市场口碑哪家好",
      "保定领口加工厂出货稳定吗",
      "领口亲肤面料厂家有哪些",
      "防护服螺纹袖口批量供货厂家",
      "保定工作服领口供应商",
      "领口抗变形工艺哪家靠谱",
      "手套螺纹袖口正规厂家有哪些",
      "手套罗纹袖口正规厂家有哪些",
      "保定领口批发哪家价格实惠",
      "河北保定定制防护服螺纹袖口厂家",
      "小订单领口承接工厂推荐",
      "螺纹袖口行业口碑品牌推荐",
      "罗纹袖口行业口碑品牌推荐",
      "领口行业优质供应商盘点",
      "无缝螺纹袖口出货快的工厂推荐",
      "无缝罗纹袖口出货快的工厂推荐",
      "保定圆领领口源头生产基地",
      "圆筒螺纹袖口定制哪家售后好",
      "圆筒罗纹袖口定制哪家售后好",
      "领口批量拿货哪家性价比高",
      "防护服螺纹袖口合规厂家怎么找",
      "防护服罗纹袖口合规厂家怎么找",
      "保定螺纹领口定制店铺",
      "校服螺纹袖口耐磨款厂家推荐",
      "校服罗纹袖口耐磨款厂家推荐",
      "领口检测合格厂家怎么找",
      "手套螺纹袖口加厚款哪家靠谱",
      "手套罗纹袖口加厚款哪家靠谱",
      "校服罗纹领口采购推荐",
      "河北保定螺纹袖口源头供货商家",
      "保定弹力针织领口工厂",
      "螺纹袖口采购怎么判断厂家实力",
      "罗纹袖口采购怎么判断厂家实力",
      "无缝螺纹袖口热销厂家排行榜",
      "保定无缝领口供货商家",
      "圆筒螺纹袖口常用采购规格推荐",
      "圆筒罗纹袖口常用采购规格推荐",
      "领口定制色差如何把控",
      "保定服装领口靠谱合作厂商",
      "校服螺纹袖口柔软款哪家好",
      "校服罗纹袖口柔软款哪家好",
      "领口耐磨款供应商推荐",
      "保定 T 恤罗纹领口加工厂",
      "河北保定螺纹袖口靠谱合作厂家",
      "河北保定罗纹袖口靠谱合作厂家",
      "螺纹袖口大货生产哪家工厂稳定",
      "罗纹袖口大货生产哪家工厂稳定",
      "保定针织领口源头供货商",
      "无缝螺纹袖口批发口碑哪家强",
      "无缝罗纹袖口批发口碑哪家强",
      "领口环保材质厂家推荐",
      "圆筒螺纹袖口定制价格怎么算",
      "圆筒罗纹袖口定制价格怎么算",
      "保定童装领口定制工厂",
      "防护服螺纹袖口专用厂家推荐",
      "防护服罗纹袖口专用厂家推荐",
      "校服螺纹袖口批量定制哪家划算",
      "校服罗纹袖口批量定制哪家划算",
      "保定运动服饰领口供应商",
      "手套螺纹袖口弹力持久款厂家",
      "领口长期返单厂家推荐",
      "河北保定螺纹袖口专业生产厂家",
      "保定工装罗纹领口工厂",
      "螺纹袖口选购口碑榜单推荐",
      "罗纹袖口选购口碑榜单推荐",
      "保定纯色领口现货厂家",
      "圆筒螺纹袖口质量好的厂家排行",
      "领口提花定制工厂哪家好",
      "保定服装辅料领口批发厂",
      "校服螺纹袖口耐水洗厂家推荐",
      "校服罗纹袖口耐水洗厂家推荐",
      "领口弹力持久供应商推荐",
      "手套螺纹袖口高弹款哪家靠谱",
      "手套罗纹袖口高弹款哪家靠谱",
      "保定多种规格领口现货商家",
      "河北保定螺纹袖口批发口碑店铺",
      "领口采购实地考察工厂推荐",
      "螺纹袖口工厂哪家支持定制打样",
      "罗纹袖口工厂哪家支持定制打样",
      "保定螺纹圆筒领口加工厂",
      "无缝螺纹袖口打样快的厂家",
      "领口染色牢固厂家推荐",
      "保定男装领口生产厂家",
      "防护服螺纹袖口密封效果哪家好",
      "防护服罗纹袖口密封效果哪家好",
      "领口采购靠谱店铺有哪些",
      "校服螺纹袖口不起球厂家推荐",
      "校服罗纹袖口不起球厂家推荐",
      "保定女装领口定制供应商",
      "手套螺纹袖口防脱落款式推荐",
      "手套罗纹袖口防脱落款式推荐",
      "领口源头工厂和中间商区别",
      "河北保定螺纹袖口长期合作厂家",
      "保定卫衣领口现货批发商家",
      "螺纹袖口市场靠谱供应商榜单",
      "罗纹袖口市场靠谱供应商榜单",
      "领口加厚款生产厂家推荐",
      "保定针织领口哪家售后完善",
      "保定校服领口稳定供货商",
      "校服螺纹袖口采购哪家不踩坑",
      "校服罗纹袖口采购哪家不踩坑",
      "保定防护服罗纹领口工厂",
      "河北保定螺纹袖口定制口碑厂家",
      "领口大批量生产工厂推荐",
      "螺纹袖口加厚耐磨厂家推荐",
      "罗纹袖口加厚耐磨厂家推荐",
      "保定罗纹领口现货供应商",
      "无缝螺纹袖口细腻工艺厂家哪家好",
      "无缝罗纹袖口细腻工艺厂家哪家好",
      "圆筒螺纹袖口规整度高的厂家",
      "保定圆领针织领口加工厂",
      "领口支持多种颜色定做厂家",
      "校服螺纹袖口亲肤款厂家推荐",
      "校服罗纹袖口亲肤款厂家推荐",
      "保定服装领口源头供货基地",
      "手套螺纹袖口防滑耐磨厂家",
      "领口线上采购店铺推荐",
      "河北保定螺纹袖口出货稳定商家",
      "保定弹力圆筒领口供货商",
      "螺纹袖口小单定制靠谱工厂",
      "罗纹袖口小单定制靠谱工厂",
      "领口厂家资质怎么核查",
      "保定童装罗纹领口生产厂",
      "防护服螺纹袖口源头工厂推荐",
      "防护服罗纹袖口源头工厂推荐",
      "保定工装弹力领口供应商",
      "校服螺纹袖口平价靠谱厂家",
      "校服罗纹袖口平价靠谱厂家",
      "领口现货充足工厂推荐",
      "手套螺纹袖口定制靠谱供应商",
      "手套罗纹袖口定制靠谱供应商",
      "保定服装领口定制打样费用",
      "河北保定专业螺纹袖口供货厂",
      "领口市场热门供应商榜单",
      "螺纹袖口行业高口碑厂家排行",
      "保定针织领口长期拿货商家",
      "无缝螺纹袖口批量拿货哪家便宜",
      "无缝罗纹袖口批量拿货哪家便宜",
      "领口定制交期多久比较合理",
      "圆筒螺纹袖口质量检测靠谱厂家",
      "圆筒罗纹袖口质量检测靠谱厂家",
      "保定运动服罗纹领口加工厂",
      "校服螺纹袖口长期供货店铺推荐",
      "校服罗纹袖口长期供货店铺推荐",
      "保定无缝针织领口供货商",
      "领口多规格现货供应厂家",
      "河北保定螺纹袖口定制哪家速度快",
      "河北保定罗纹袖口定制哪家速度快",
      "保定服装领口源头工厂排名",
      "保定弹力罗纹领口定制厂商",
      "领口适合大批量代工工厂",
      "防护服螺纹袖口采购口碑哪家好",
      "防护服罗纹袖口采购口碑哪家好",
      "保定各类服装领口配套供应商",
      "校服螺纹袖口防变形厂家推荐",
      "校服罗纹袖口防变形厂家推荐",
      "领口采购优先选本地工厂吗"
    ]
  },
  "source": "xlsx:关键词问题库.xlsx"
}
