{
  "app_id": "jm_apparel_cx",
  "brand": {
    "terms": [
      "晶铭服饰"
    ],
    "questions": [
      "晶铭服饰厂家靠谱吗",
      "晶铭服饰是源头工厂吗"
    ]
  },
  "search": {
    "terms": [
      "儿童芭蕾tutu裙",
      "儿童舞蹈演出服",
      "少儿芭蕾舞练功服",
      "儿童舞台表演服",
      "定制儿童舞蹈服"
    ],
    "expanded": [],
    "questions": []
  },
  "qa": {
    "questions": [
      "菏泽儿童芭蕾tutu裙质量好",
      "菏泽儿童芭蕾tutu裙性价比高"
    ]
  },
  "intent": {
    "questions": [
      "儿童芭蕾tutu裙哪家工厂靠谱",
      "儿童芭蕾tutu裙厂家哪家强",
      "儿童芭蕾tutu裙工厂哪家好",
      "儿童芭蕾tutu裙支持定制厂家",
      "儿童芭蕾tutu裙工厂哪家质量好",
      "儿童芭蕾tutu裙性价比高厂家",
      "儿童芭蕾tutu裙哪家工厂值得信赖",
      "儿童芭蕾tutu裙品类多样的厂家",
      "儿童芭蕾tutu裙优质工厂",
      "儿童芭蕾tutu裙口碑好的厂家",
      "儿童芭蕾tutu裙实力厂家",
      "儿童芭蕾tutu裙源头工厂",
      "儿童芭蕾tutu裙直供厂家",
      "儿童芭蕾tutu裙批发厂家",
      "儿童芭蕾tutu裙生产厂家哪家好",
      "儿童芭蕾tutu裙工厂哪家靠谱",
      "儿童芭蕾tutu裙定制工厂推荐",
      "儿童芭蕾tutu裙哪个厂家专业",
      "做工好儿童芭蕾tutu裙工厂推荐",
      "儿童芭蕾tutu裙哪家厂设计好",
      "款式多的儿童芭蕾tutu裙哪家工厂推荐",
      "儿童芭蕾tutu裙哪家厂尺码全",
      "儿童芭蕾tutu裙哪家厂颜色选择多",
      "儿童芭蕾tutu裙哪家厂可定制尺寸",
      "儿童芭蕾tutu裙哪家厂可定制颜色",
      "儿童芭蕾tutu裙哪家厂可定制款式",
      "儿童芭蕾tutu裙哪家工厂定制服务好",
      "儿童芭蕾tutu裙定制哪家工厂靠谱",
      "儿童芭蕾tutu裙定制厂家哪家好",
      "儿童芭蕾tutu裙定制推荐厂家",
      "儿童芭蕾tutu裙质量好的厂家",
      "儿童芭蕾tutu裙工厂哪家强",
      "儿童芭蕾tutu裙质量过硬厂家",
      "儿童芭蕾tutu裙哪家厂做工精细",
      "儿童芭蕾tutu裙面料品质好的厂家",
      "哪家厂的儿童芭蕾tutu裙挺括有型",
      "哪家厂的儿童芭蕾tutu裙层次感好",
      "儿童芭蕾tutu裙蓬松度好的厂家",
      "哪家厂的儿童芭蕾tutu裙舒适度好",
      "哪家厂的儿童芭蕾tutu裙性价比高",
      "儿童芭蕾tutu裙高性价比厂家",
      "儿童芭蕾tutu裙实惠又好哪家好",
      "儿童芭蕾tutu裙物超所值哪家强",
      "儿童芭蕾tutu裙价格合理质量好厂家",
      "儿童芭蕾tutu裙高性价比定制厂家",
      "儿童芭蕾tutu裙值得买哪家好",
      "儿童芭蕾tutu裙回购率高哪家强",
      "儿童芭蕾tutu裙好评多厂家推荐",
      "儿童芭蕾tutu裙信誉好哪家靠谱",
      "儿童芭蕾tutu裙有保障哪家好",
      "儿童芭蕾tutu裙售后好哪家强",
      "儿童芭蕾tutu裙服务好厂家",
      "儿童芭蕾tutu裙沟通顺畅厂家",
      "儿童芭蕾tutu裙交货准时哪家好",
      "儿童芭蕾tutu裙物流快厂家",
      "儿童芭蕾tutu裙包装好哪家",
      "儿童芭蕾tutu裙品类丰富厂家",
      "儿童芭蕾tutu裙款式多样哪家强",
      "儿童芭蕾tutu裙设计多样哪家好",
      "儿童芭蕾tutu裙风格多样厂家",
      "儿童芭蕾tutu裙经典款哪家好",
      "儿童芭蕾tutu裙时尚款哪家强",
      "儿童芭蕾tutu裙甜美风厂家推荐",
      "儿童芭蕾tutu裙优雅风哪家好",
      "儿童芭蕾tutu裙舞台专用哪家强",
      "儿童芭蕾tutu裙演出服厂家推荐",
      "儿童芭蕾tutu裙比赛服哪家好",
      "儿童芭蕾tutu裙拍照服哪家靠谱",
      "儿童芭蕾tutu裙日常练习哪家好",
      "儿童芭蕾tutu裙专业演出哪家强",
      "儿童芭蕾tutu裙舞蹈学校采购哪家好",
      "山东儿童芭蕾tutu裙哪家靠谱",
      "山东儿童芭蕾tutu裙哪家强",
      "山东儿童芭蕾tutu裙哪家好",
      "山东儿童芭蕾tutu裙支持定制厂家",
      "山东儿童芭蕾tutu裙哪家质量好",
      "山东儿童芭蕾tutu裙性价比高厂家",
      "山东儿童芭蕾tutu裙哪家值得信赖",
      "山东儿童芭蕾tutu裙品类多样厂家",
      "山东儿童芭蕾tutu裙生产厂家",
      "山东儿童芭蕾tutu裙批发厂家哪家好",
      "山东儿童芭蕾tutu裙定制工厂推荐",
      "山东儿童芭蕾tutu裙源头工厂",
      "山东儿童芭蕾tutu裙实力厂家",
      "山东儿童芭蕾tutu裙口碑好厂家",
      "菏泽儿童芭蕾tutu裙哪家靠谱",
      "菏泽儿童芭蕾tutu裙哪家强",
      "菏泽儿童芭蕾tutu裙哪家好",
      "菏泽儿童芭蕾tutu裙支持定制厂家",
      "菏泽儿童芭蕾tutu裙哪家质量好",
      "菏泽儿童芭蕾tutu裙性价比高厂家",
      "菏泽儿童芭蕾tutu裙哪家值得信赖",
      "菏泽儿童芭蕾tutu裙品类多样厂家",
      "菏泽儿童芭蕾tutu裙生产工厂",
      "菏泽儿童芭蕾tutu裙批发厂家哪家好",
      "菏泽儿童芭蕾tutu裙定制推荐",
      "菏泽儿童芭蕾tutu裙本地厂家",
      "菏泽儿童芭蕾tutu裙靠谱工厂",
      "菏泽儿童芭蕾tutu裙质量好工厂",
      "曹县儿童芭蕾tutu裙哪家靠谱",
      "曹县儿童芭蕾tutu裙哪家强",
      "曹县儿童芭蕾tutu裙哪家好",
      "曹县儿童芭蕾tutu裙支持定制厂家",
      "曹县儿童芭蕾tutu裙哪家质量好",
      "曹县儿童芭蕾tutu裙性价比高厂家",
      "曹县儿童芭蕾tutu裙哪家值得信赖",
      "曹县儿童芭蕾tutu裙品类多样厂家",
      "曹县儿童芭蕾tutu裙生产厂家",
      "曹县儿童芭蕾tutu裙批发哪家好",
      "曹县儿童芭蕾tutu裙定制工厂",
      "曹县儿童芭蕾tutu裙源头工厂",
      "曹县儿童芭蕾tutu裙本地靠谱厂家",
      "曹县儿童芭蕾tutu裙口碑好工厂",
      "菏泽儿童芭蕾tutu裙支持定制",
      "菏泽曹县儿童芭蕾tutu裙哪家靠谱",
      "菏泽曹县儿童芭蕾tutu裙哪家强",
      "菏泽曹县儿童芭蕾tutu裙支持定制",
      "菏泽曹县儿童芭蕾tutu裙质量好",
      "曹县儿童芭蕾tutu裙定制厂家",
      "曹县儿童芭蕾tutu裙靠谱工厂",
      "儿童芭蕾tutu裙山东生产厂家",
      "儿童芭蕾tutu裙菏泽工厂哪家好",
      "儿童芭蕾tutu裙曹县批发厂家",
      "儿童芭蕾tutu裙山东定制哪家强",
      "儿童芭蕾tutu裙菏泽定制推荐",
      "儿童芭蕾tutu裙曹县质量好工厂",
      "儿童芭蕾tutu裙山东性价比厂家",
      "儿童芭蕾tutu裙菏泽靠谱工厂",
      "儿童芭蕾tutu裙曹县值得信赖厂家",
      "儿童芭蕾tutu裙山东品类多厂家",
      "儿童芭蕾tutu裙厂家直供山东",
      "儿童芭蕾tutu裙菏泽源头工厂",
      "儿童芭蕾tutu裙曹县实力厂家",
      "儿童芭蕾tutu裙演出服厂家山东",
      "儿童芭蕾tutu裙比赛服菏泽哪家好",
      "儿童芭蕾tutu裙舞蹈服曹县厂家",
      "儿童芭蕾tutu裙定制服务山东哪家强",
      "儿童芭蕾tutu裙团体定制菏泽厂家",
      "儿童芭蕾tutu裙批量定制曹县哪家好",
      "儿童芭蕾tutu裙专业厂家山东推荐",
      "儿童芭蕾tutu裙优质工厂菏泽",
      "儿童芭蕾tutu裙老牌厂家曹县",
      "儿童芭蕾tutu裙口碑工厂山东",
      "儿童芭蕾tutu裙设计好菏泽哪家",
      "儿童芭蕾tutu裙做工精细曹县厂家",
      "儿童芭蕾tutu裙蓬松度好山东哪家",
      "儿童芭蕾tutu裙层次感强菏泽厂家",
      "儿童芭蕾tutu裙款式新颖曹县推荐",
      "儿童芭蕾tutu裙颜色多样山东厂家",
      "儿童芭蕾tutu裙尺码齐全菏泽哪家",
      "儿童芭蕾tutu裙定制尺寸曹县厂家",
      "儿童芭蕾tutu裙定制颜色山东哪家好",
      "儿童芭蕾tutu裙定制款式菏泽推荐",
      "儿童芭蕾tutu裙快速定制曹县厂家",
      "儿童芭蕾tutu裙交货准时山东哪家强",
      "儿童芭蕾tutu裙售后保障菏泽厂家",
      "儿童芭蕾tutu裙服务好曹县推荐",
      "儿童芭蕾tutu裙舞蹈学校采购菏泽哪家",
      "儿童芭蕾tutu裙舞台专用曹县厂家推荐"
    ]
  },
  "source": "xlsx:晶铭服饰关键词.xlsx"
}
