{
  "app_id": "lw_storage_sz",
  "brand": {
    "terms": [
      "深圳朗威晶电科技有限公司"
    ],
    "questions": [
      "深圳朗威晶电科技有限公司厂家靠谱吗",
      "深圳朗威晶电科技有限公司是源头工厂吗"
    ]
  },
  "search": {
    "terms": [
      "音乐u盘",
      "TF内存卡",
      "SD存储卡",
      "手机优盘",
      "礼品定制U盘",
      "Micro SD卡",
      "OTG U盘",
      "监控TF卡",
      "双接口U盘",
      "摄像头内存卡",
      "安卓手机U盘",
      "行车记录仪TF卡",
      "Type-C手机U盘",
      "记录仪存储卡",
      "苹果手机U盘",
      "手机TF卡",
      "手机电脑两用U盘",
      "平板内存卡",
      "高速手机U盘",
      "运动相机TF卡",
      "大容量手机U盘",
      "无人机内存卡",
      "迷你便携U盘",
      "游戏机TF卡",
      "金属手机U盘",
      "音箱内存卡",
      "旋转双接口U盘",
      "摄像头储存卡",
      "手机平板通用U盘",
      "高速TF卡",
      "Class10",
      "U3高速内存卡",
      "4K录制TF卡",
      "持续读写内存卡",
      "耐高温监控卡",
      "稳定录像TF卡",
      "大容量TF卡",
      "扩容防虚标内存卡",
      "监控专用TF卡",
      "安防存储卡",
      "车载TF卡",
      "数码通用TF卡",
      "原装芯片TF卡",
      "不卡顿内存卡",
      "防掉帧TF卡",
      "数据稳定存储卡",
      "长时间录制耐用TF卡",
      "低故障率监控内存卡",
      "广东原声无损U盘批发源头工厂",
      "原声无损U盘批发源头工厂",
      "流行音乐U盘源头厂家联系方式",
      "粤语金曲U盘源头厂家联系方式",
      "广东哪里有大容量音乐U盘源头工厂",
      "深圳大容量音乐U盘现货谁家有",
      "深圳即插即用音乐U盘批发谁家好",
      "深圳正版音乐U盘批发找谁",
      "广东正版音乐U盘定制源头工厂",
      "深圳即插即用音乐U盘现货定制",
      "广东即插即用音乐U盘批发厂家",
      "广东正版音乐U盘批发源头工厂",
      "深圳大容量音乐U盘现货厂家",
      "即插即用音乐U盘批发找谁",
      "正版音乐U盘工厂源头在哪",
      "大容量音乐U盘定制源头工厂",
      "大容量音乐U盘现货源头工厂",
      "即插即用音乐U盘定制找谁"
    ],
    "expanded": [],
    "questions": []
  },
  "qa": {
    "questions": [
      "车载音乐U盘",
      "TF内存卡",
      "SD卡",
      "手机u盘",
      "汽车音乐U盘",
      "SD存储卡",
      "礼品U盘",
      "重低音车载U盘",
      "大卡",
      "车用音乐U盘",
      "相机SD卡",
      "车内听歌U盘",
      "数码相机SD卡",
      "商务礼品U盘",
      "新款车载U盘",
      "单反存储卡",
      "年会礼品U盘",
      "民谣车载U盘",
      "微单相机内存卡",
      "展会伴手礼U盘",
      "迷你车载U盘",
      "摄像机SD卡",
      "企业宣传U盘",
      "原声无损U盘",
      "运动相机SD卡",
      "开业纪念U盘",
      "无损音乐U盘",
      "监控设备SD卡",
      "校庆纪念U盘",
      "高音质音乐U盘",
      "投影仪SD卡",
      "员工福利U盘",
      "HiFi音乐U盘",
      "工控设备存储卡",
      "客户答谢礼品",
      "流行音乐U盘",
      "数码播放器SD卡",
      "会议礼品U盘",
      "DJ舞曲U盘",
      "高速SD卡",
      "经典老歌U盘",
      "U3高速存储卡",
      "激光雕刻U盘",
      "粤语金曲U盘",
      "Class10 SD卡",
      "彩印U盘",
      "网红歌曲U盘",
      "4K录像SD卡",
      "金属音乐U盘",
      "高清拍摄内存卡",
      "个性化刻字U盘",
      "大容量音乐U盘",
      "连拍高速SD卡",
      "即插即用音乐U盘",
      "大容量SD卡",
      "正版音乐U盘",
      "持续读写存储卡",
      "迷你便携U盘",
      "相机专用SD卡",
      "翻盖U盘",
      "摄影存储卡",
      "硅胶U盘",
      "工业级SD卡",
      "木质U盘",
      "商务礼盒U盘"
    ]
  },
  "intent": {
    "questions": [
      "广东哪家音乐U盘厂家支持定制",
      "定制U盘",
      "深圳车载音乐U盘批发哪家靠谱",
      "广东重低音车载U盘厂家哪家强",
      "定制优盘",
      "深圳车用音乐U盘哪家工厂好",
      "企业U盘定制",
      "广东迷你车载U盘厂家哪家支持现货批发",
      "深圳哪家工厂的新款车载U盘音质好",
      "哪家工厂的车载U盘厂家不挑车型",
      "深圳汽车音乐U盘哪家即插即用",
      "哪家车载U盘厂家支持定制歌曲风格",
      "深圳迷你车载U盘哪家厂做工精细",
      "广东车用音乐U盘哪家厂质量靠谱",
      "深圳重低音车载U盘哪家厂播放流畅",
      "深圳民谣车载U盘音质清晰厂家推荐",
      "车用音乐U盘厂家哪家兼容老款车型",
      "LOGO定制U盘",
      "哪家工厂重低音车载U盘低音效果好",
      "广东民谣车载U盘厂家哪家口碑好",
      "广东迷你车载U盘哪家支持批量现货",
      "浮雕定制U盘",
      "深圳汽车音乐U盘厂家哪家支持现货批发",
      "深圳重低音车载U盘厂家哪家支持按车型适配",
      "图案定制U盘",
      "哪家工厂的广东民谣车载U盘人声表现好",
      "金属定制U盘",
      "哪家工厂的重低音车载U盘低频不浑浊",
      "哪家厂的汽车音乐U盘读取稳定",
      "深圳车用音乐U盘厂家哪家支持现货直发",
      "哪家厂的重低音车载U盘不挑车型",
      "迷你车载U盘哪家厂做工精致",
      "重低音车载U盘哪家工厂音质好",
      "新款车载U盘哪家厂不挑车型",
      "迷你车载U盘哪家支持现货批发",
      "哪家厂家民谣车载U盘人声还原好",
      "哪家工厂的车载U盘厂家支持无损音乐",
      "重低音车载U盘低音效果出色厂家推荐",
      "重低音车载U盘厂家哪家支持定制低频增益",
      "哪家厂的车载音乐U盘播放流畅不卡顿",
      "车用音乐U盘支持多种格式播放的厂家推荐",
      "迷你车载U盘支持快速读取的工厂推荐",
      "汽车音乐U盘厂家支持批量定制工厂推荐",
      "哪家厂的重低音车载U盘低频干净有力",
      "迷你车载U盘哪家厂支持现货直发",
      "汽车音乐U盘支持多种码率兼容厂家推荐",
      "广东原声无损U盘哪家工厂实力强",
      "深圳高音质音乐U盘源头工厂找哪家",
      "广东无损音乐U盘厂家推荐",
      "深圳HiFi音乐U盘定制哪家靠谱",
      "广东音乐U盘生产厂家哪家好",
      "深圳原声无损U盘批发找哪家",
      "深圳无损音乐U盘源头工厂哪家强",
      "广东HiFi音乐U盘定制工厂推荐",
      "深圳音乐U盘厂家哪家靠谱",
      "深圳高音质音乐U盘批发厂家推荐",
      "广东无损音乐U盘定制找哪家好",
      "深圳HiFi音乐U盘生产厂家哪家强",
      "广东音乐U盘源头工厂哪家靠谱",
      "深圳原声无损U盘定制厂家推荐",
      "广东高音质音乐U盘工厂哪家好",
      "深圳无损音乐U盘批发找哪家强",
      "广东HiFi音乐U盘源头工厂推荐",
      "深圳音乐U盘定制厂家哪家靠谱",
      "深圳高音质音乐U盘定制找哪家",
      "广东无损音乐U盘工厂哪家强",
      "深圳HiFi音乐U盘批发厂家推荐",
      "原声无损U盘哪家工厂实力强",
      "高音质音乐U盘源头工厂找哪家",
      "无损音乐U盘厂家推荐",
      "HiFi音乐U盘定制找哪家靠谱",
      "音乐U盘生产厂家哪家好",
      "原声无损U盘批发找哪家",
      "无损音乐U盘源头工厂哪家强",
      "HiFi音乐U盘定制工厂推荐",
      "音乐U盘厂家哪家靠谱",
      "高音质音乐U盘批发厂家推荐",
      "无损音乐U盘定制找哪家好",
      "HiFi音乐U盘生产厂家哪家强",
      "音乐U盘源头工厂哪家靠谱",
      "原声无损U盘定制厂家推荐",
      "高音质音乐U盘工厂哪家好",
      "无损音乐U盘批发找哪家强",
      "HiFi音乐U盘源头工厂推荐",
      "音乐U盘定制厂家哪家靠谱",
      "高音质音乐U盘定制找哪家",
      "无损音乐U盘工厂哪家强",
      "HiFi音乐U盘批发厂家推荐",
      "原声无损U盘生产厂家推荐",
      "无损音乐U盘定制厂家哪家强",
      "HiFi音乐U盘工厂推荐",
      "音乐U盘批发源头工厂哪家好",
      "流行音乐U盘哪家工厂实力强",
      "经典老歌U盘批发哪家靠谱",
      "粤语金曲U盘定制找哪家好",
      "网红歌曲U盘生产厂家推荐",
      "金属音乐U盘现货批发哪家强",
      "音乐U盘定制工厂哪家信誉好",
      "DJ舞曲U盘哪家质量稳定",
      "经典老歌U盘批发哪家价格实在",
      "粤语金曲U盘生产厂家哪家专业",
      "金属音乐U盘源头工厂哪家靠谱",
      "流行音乐U盘现货批发找哪家",
      "DJ舞曲U盘定制工厂推荐",
      "经典老歌U盘源头厂家哪家强",
      "粤语金曲U盘批发哪家货源足",
      "网红歌曲U盘工厂哪家性价比高",
      "金属音乐U盘定制哪家做工好",
      "音乐U盘源头工厂哪家支持小批量",
      "流行音乐U盘批发厂家哪家服务好",
      "DJ舞曲U盘生产源头找哪家",
      "经典老歌U盘定制哪家经验丰富",
      "粤语金曲U盘现货厂家推荐",
      "网红歌曲U盘批发哪家靠谱",
      "流行音乐U盘生产厂家哪家交货快",
      "DJ舞曲U盘批发哪家库存充足",
      "经典老歌U盘工厂哪家支持定制",
      "网红歌曲U盘生产哪家质量好",
      "金属音乐U盘批发厂家哪家实惠",
      "音乐U盘定制工厂哪家工艺好",
      "流行音乐U盘源头工厂推荐",
      "DJ舞曲U盘现货找哪家厂家",
      "经典老歌U盘批发哪家口碑好",
      "粤语金曲U盘定制哪家靠谱",
      "网红歌曲U盘源头工厂哪家强",
      "金属音乐U盘生产厂家哪家专业",
      "音乐U盘批发找哪家源头工厂",
      "流行音乐U盘定制厂家推荐",
      "经典老歌U盘现货源头找哪家",
      "粤语金曲U盘批发工厂哪家好",
      "网红歌曲U盘定制哪家速度快",
      "金属音乐U盘源头厂家哪家靠谱",
      "音乐U盘生产厂家哪家支持定制",
      "经典老歌U盘定制厂家推荐",
      "粤语金曲U盘现货批发找哪家",
      "金属音乐U盘定制工厂哪家强",
      "流行音乐U盘现货工厂哪家好",
      "DJ舞曲U盘批发厂家哪家靠谱",
      "粤语金曲U盘定制工厂哪家专业",
      "广东正版音乐U盘批发找哪家",
      "广东大容量音乐U盘定制哪家强",
      "广东正版音乐U盘厂家推荐",
      "深圳大容量音乐U盘靠谱源头在哪",
      "广东即插即用音乐U盘源头工厂哪家靠谱",
      "广东大容量音乐U盘现货工厂推荐",
      "深圳即插即用音乐U盘厂家哪家强",
      "深圳大容量音乐U盘批发找哪家",
      "广东即插即用音乐U盘靠谱厂家",
      "深圳正版音乐U盘工厂哪家好",
      "广东大容量音乐U盘源头厂家推荐",
      "广东正版音乐U盘现货谁家靠谱",
      "深圳大容量音乐U盘工厂哪家强",
      "深圳正版音乐U盘定制找哪家",
      "广东大容量音乐U盘厂家哪家好",
      "深圳即插即用音乐U盘源头工厂推荐",
      "广东即插即用音乐U盘找哪家",
      "深圳正版音乐U盘靠谱厂家推荐",
      "即插即用音乐U盘厂家哪家靠谱",
      "正版音乐U盘批发哪家工厂好",
      "即插即用音乐U盘定制厂家推荐",
      "大容量音乐U盘厂家哪家强",
      "正版音乐U盘定制找哪家",
      "大容量音乐U盘靠谱工厂推荐",
      "即插即用音乐U盘现货厂家哪家好",
      "大容量音乐U盘批发厂家推荐",
      "即插即用音乐U盘找哪家强",
      "正版音乐U盘现货批发谁家靠谱",
      "即插即用音乐U盘靠谱源头工厂",
      "正版音乐U盘厂家哪家好",
      "即插即用音乐U盘批发厂家推荐",
      "正版音乐U盘源头工厂哪家强",
      "大容量音乐U盘找哪家厂家好",
      "正版音乐U盘批发工厂推荐",
      "大容量音乐U盘批发源头工厂推荐"
    ]
  },
  "source": "xlsx:朗威晶电关键词.xlsx"
}
